OTD 3 years ago F1 and Motorsport lost a legend.DankeNiki,sports
  Nadal  won the FrenchOpen 2007 final against Federer to become the first man to lift the trophy in Paris for three years in a row since Swedish great Bjorn Borg who achieved the feat between 1978 and 1981. Writes Nihit Sachdeva  Read more,sports
Liverpool manager Juergen Klopp heaped praise on his forward Sadio Mane after the Senegalese scored the winner against Aston Villa that kept his side alive in the PremierLeague  title race.httptiny.cckngruz,sports
What do the Australian Mens Cricket Team and Rafael Nadal have in common when it comes to the year 2007 It was the year when the Ricky Pontingled Australian side won a third consecutive ODI World Cup while Spains Nadal completed his hattrick of FrenchOpen titles. The two also shared sheer dominance in achieving those feats.RolandGarros Nihit Sachdevahttps ,sports
A PierreEmerick Aubameyang brace earned Barcelona a 31 home win against Celta Vigo on Tuesday. LaLiga Barcelona httptiny.ccfngruz,sports
Sadio Mane headed the winner as Liverpool came from a goal down to edge Aston Villa 21 on Tuesday and keep alive its hopes of reclaiming the Premier League title from leaders Manchester City. EPL ManCity LiverpoolFC httptiny.ccdngruz,sports
Jyothi Yarraji smashed the national record while winning the 100m hurdles at the Cyprus International Meet with a timing of 13.23 seconds on Tuesday. httptiny.ccbngruz,sports
 GT beat LSG to become the 1st team to qualify for IPL2022 playoffs  Erling Haaland to join Manchester City in July  Djokovic  advanced to the 3rd round of Italian Open All this and much more in our dailybriefing ,sports
Making her World championships debut at the elite level reigning National champion Nitu Ghanghas beat Steluta 50 in a highly physical bout. https ,sports
LSG seven down finds itself in dire straits.  FOLLOW IPL2022 LSGvGT LIVE  ,sports
Tabletopper GKFC was on the cusp of winning the title but came undone at the hands of its former player Lalromawia who scored a first half hattrick. ILeague https ,sports
Sensational glovework from Wriddhiman Saha sees the back of Krunal Pandya  FOLLOW IPL2022 LSGvGT LIVE  ,sports
Yash Dayal gets things rolling for GT with Quinton de Kocks wicket.   LSG is 126 away from confirming the first IPL2022 Playoffs berth.  FOLLOW IPL2022 LSGvGT LIVE  ,sports
Shubman Gill gets to his halfcentury.  GT 1044 in 16.1 overs  FOLLOW IPL2022 LSGvGT LIVE  ,sports
BREAKING Manchester City has reached an agreement with Borussia Dortmund for the transfer of striker Erling Haaland in July. https ,sports
Thats the big fish Hardik Pandyas been caught behind.  FOLLOW IPL2022 LSGvGT LIVE  ,sports
Mohsin Khan provides the breakthrough Wriddhiman Saha departs.   FOLLOW IPL2022 LSGvGT LIVE  ,sports
TOSS Gujarat Titans opt to bat.  LSG Qdk KL Hooda Krunal Badoni Stoinis Holder Karan Chameera Avesh Mohsin  GT Saha Gill Wade Hardik Miller Tewatia Rashid Sai Kishore Joseph Dayal Shami  FOLLOW IPL2022 LSGvGT LIVE  ,sports
Ranveer Singh AR Rahman roped in for IPL2022 closing ceremony  Shayan Acharya reports https ,sports
Former England batsman and assistant coach Graham Thorpe is seriously ill in hospital the Professional Cricketers Association said on Tuesday.https ,sports
Igor Stimac feels India needs to be wary of the strength and international experience of Afghanistan when the national team makes its bid to qualify for the 2023 AFC Asian Cup. https ,sports
Cricket South Africa CSA dropped all charges of gross misconduct including racism against national coach Mark Boucher. Cricket httptiny.ccrpfruz,sports
English Football League Chairman Rick Parry said the League Cup is not under threat amid potential scheduling issues due to the Champions Leagues looming expansion. football httptiny.cc8mfruz,sports
Indian womens badminton team sailed into the knockout stage of the UberCup Final after humbling USA 41 in a lopsided Group D match. badminton httptiny.ccpkfruz,sports
Monty Williams now has the honour that his Phoenix Suns players have been clamoring that he receive for two years NBAs Coach of the Year. NBATwitter httptiny.cc0ifruz,sports
Stanislas Wawrinka won his first match in 15 months as he moved into the second round of the Italian Open while Dominic Thiem fell in the first round. ItalianOpen Tennis httptiny.cczhfruz,sports
CONMEBOL increased sanctions against clubs with players officials and fans deemed guilty of racist behaviour taking action after a spate of unsavoury incidents in its top club competitions.football httptiny.ccvhfruz,sports
 On stands this fortnight  COVER Dipika Pallikal Karthik Squashing Stereotypes INTERVIEWS Glenn McGrath Rohan Bopanna Umran Malik Sumit Antil  DEEP DIVE Asian Games Santosh Trophy IPL2022 ChampionsLeagueSubscribe for a copy   ,sports
Former Olympic champion Chad le Clos was named on South Africas team on Monday for his seventh swimming world championships.Swimming httptiny.ccxffruz,sports
KKR beat MI by 52 runs in IPL2022 Suryakumar Yadav ruled out of this years IPL due to a muscle injury Carlos Alcaraz rose three places to sixth in the mens ATP rankingsAll this and much more in our dailybriefing ,sports
Lovlina Borgohain who returned to action for the first time since her Tokyo Olympics bronze medal got off to a winning start at the 2022 Womens Boxing World Championship. https ,sports
World No.1 Novak Djokovic heaped praise on newlycrowned Madrid Open champion Carlos Alcaraz saying that he is a firm favourite for the FrenchOpen. https ,sports
Dinesh Karthik the finisher continues knocking on India door. IPL2022 https ,sports
The qualifier in September was suspended just minutes after kickoff when Brazilian health officials invaded the pitch to stop Argentinas Englandbased players from playing. https ,sports
Is Erling Haaland the missing piece Manchester City needs to win its first Champions League title  Haaland close to sealing Man City transfer https ,sports
After Tokyo Olympics disappointment Annu Rani says she did not have the courage to go home.  Interview by Stan Rayan  https ,sports
Australian womens team star keeperbatter Alyssa Healy and South African mens side spinner Keshav Maharaj were on Monday voted the ICCs Player of the Month for April in their respective categories. Cricket CricketTwitter https ,sports
The Dallas Mavericks rained 20 threepointers and again neutralized Phoenix point guard Chris Paul to beat the topseeded Suns 111101 on Sunday and knot their NBA playoff series at two games each. NBA basketball https ,sports
Manchester United is set to undergo major changes after another disappointing season but former midfielder David Beckham hopes Cristiano Ronaldo sticks around for at least another year. DavidBeckham Ronaldo ManchesterUnited football https ,sports
Leading up to the 2022 French Open which begins on May 22 this series will take you through Rafael Nadals 13 French Open titles the most number of times a single Major has been won by a player.RolandGarros Nihit Sachdevahttps ,sports
Ferraris Carlos Sainz is hoping that Sundays podium finish in Miami marks a turning point in his fortunes ahead of his home Grand Prix in Spain later this month.MiamiGrandPrix Ferrari Formula1 https ,sports
Manchester City will be without three key defenders for the rest of the Premier League title race after manager Pep Guardiola confirmed Ruben Dias was out for the season on Sunday. ManchesterCity EPL football https ,sports
Newlycrowned Madrid Open champion Carlos Alcaraz said on Sunday he has decided to skip the Rome Masters in a bid to recover from an ankle injury ahead of the French Open later this month. MadridOpen Tennis https ,sports
World number three Alexander Zverev blamed the ATP Tours scheduling for his underwhelming performance in Sundays Madrid Open final. MadridOpen2022 Zverev https ,sports
Carlos Alcaraz wins MadridOpen2022 Verstappen beats Leclerc to win first MiamiGrandPrix  Chelsea pips Arsenal to retain WSL crownIPL2022 PremierLeague LaLiga newsAll this and more in todays DailyBriefing ,sports
A double from birthday boy Sandro Tonali moved AC Milan one step closer to its first Serie A title in 11 years after it regained top spot with a 31 comeback victory at Hellas Verona on Sunday. SerieA ACMilan football https ,sports
A firsthalf penalty by Yannick Carrasco earned Atletico Madrid a 10 victory in a fiery derby clash against champions Real Madrid on Sunday as the hosts tightened its grip on a place in next seasons Champions League. AtleticoRealMadrid football https ,sports
Formula One world champion Max Verstappen won the inaugural Miami Grand Prix for Red Bull on Sunday slashing Ferrari rival Charles Leclercs overall lead from 27 to 19 points after five races. MiamiGP Verstappen Formula1 https ,sports
Carlos Alcaraz capped another impressive week with a straightset victory over Alexander Zverev on Sunday to win the Madrid Open and become the secondyoungest player to win two Masters 1000 titles. MadridOpen CarlosAlcaraz Tennis https ,sports
Manchester City reclaimed top spot in the PremierLeague with a 50 drubbing of Newcastle United that allowed the reigning champion to open up a threepoint lead over Liverpool at the Etihad Stadium on Sunday. MCINEW ,sports
CSK annihilate DC to earn its fourth win of the season.Moeen Ali the wreckerinchief with the ball.CSKvDC  IPL2022   ,sports
After a third golden duck Virat Kohlis IPL2022 season continues to grow from bad to worse. https ,sports
Full Time ManCity 50 NUFC SterlingLaporteRodriFodenManCity back on top of the PremierLeague table with 86 pointsLiverpool at 83 pointsHighlights   ,sports
Magic Mo has another.Rishabh Pant drags on as Delhi loses its fourth wicket.DC 754 in 9.1 overs Target 209CSKvDC  IPL2022   ,sports
61 GOAL De Bruynes corner kick headed into the net by Rodri as ManCity goes 3 in front against NewcastleUnited MCINEW   ,sports
Annu Rani bettered her own national record with a throw of 63.82m in her first attempt  https ,sports
Second Half begins at Etihad as ManCity looks to maintain its 3point lead over Liverpool in the PremierLeague title race.MCINEWLive   ,sports
HalfTime ManCity sits 2 goals ahead of NewcastleUnited and on top of the PremierLeague table.MCINEWLive   ,sports
38 GOAL Laporte doubles the lead for ManCity against NUFC in the PremierLeague ManCity 20 NUFC  MCINEWLive   ,sports
MSDs 8ball 21 powers CSK to its fourth 200plus total of the seasonDC needs 209 to win in 20 oversCSKvDC  IPL2022   ,sports
19 GOAL Sterling puts ManCity in front and Guardiolas side is on top of the PremierLeague again.ManCity 10 NUFC  MCINEW Live   ,sports
KickOff The PremierLeague match between ManCity and NUFC is underwayMCINEW Live   ,sports
Conway misses a welldeserved ton. He falls for 87 off 49 balls.CSK 1692 in 16.3 oversCSKvDC  IPL2022   ,sports
Gaikwad and Conway go past the 100run mark once again CSK 1000 in 10 overs Gaikwad 32 Conway 63CSKvDC  IPL2022   ,sports
Third consecutive halfcentury for Devon Conway CSK 830 in 8.4 oversCSKvDC  IPL2022   ,sports
MCINEW Lineups outManCity  Ederson GKZinchenkoCanceloDiasLaporteGundogan CRodriDe BruyneSterlingJesusGrealishNUFC   DubravkaGKKrafthLascellesCBurnTargettLongstaffGuimaraesJoelintonAlmironSaintMaximinWoodLive   ,sports
After twotime Olympic medallist P V Sindhu gave India a winning start Canada levelled things up in the Group D opener of the UberCup  https ,sports
TOSS Delhi opts to bowlCSK XI Ruturaj Conway Ali Uthappa Rayudu Dhoni Dube Pretorius Simarjeet Mukesh MaheeshDC XI KS Bharat Warner Marsh Pant Powell Axar Ripal Shardul Kuldeep Nortje KhaleelCSKvDC  IPL 2022  https ,sports
Worlds No. 1 Test bowler  Asheswinning captain  ODI  T20 World Cup winner   Pat Cummins turns 29 today ,sports
Chelsea pips Arsenal to retain WSL crown makes its three in a row https ,sports
The IPL2022 contest between Delhi Capitals and Chennai Super Kings will go ahead despite COVID19 concerns emerging in the DC camp earlier on Sunday.https ,sports
Is Atletico Madrids Simeone justified in denying Real Madrid a guard of honour ahead of the MadridDerby  https ,sports
 From the physical trials to the mental tolls of returning to sports postpregnancy this is the story of Sarita Devi in her own words.TheIncredibles  MothersDay  httpsyoutu.behfYFzWGyKz0,sports
 TeamIndia update  Dhanush Srikanth teamed up with Priyesha Deshmukh to win the 10m air rifle mixed team competition and extend Indian shooters gold rush at the 24th Deaflympics in Caxais do Sul Brazil.https ,sports
 Badminton  Lakshya Sen Kidambi Srikanth Satwiksairaj Rankireddy and Chirag Shetty all registered wins as India got its ThomasCup campaign off to a winning start.https ,sports
While Bucks beat Celtics 103101 Warriors thrashed Grizzlies 142112 in Game 3 of their respective conference semifinals of the NBAplayoffs on Saturday.https ,sports
 On MothersDay this year Sportstar looks at TheIncredibles  athletes who have continued to succeed in their sporting careers after motherhood. MothersDay2022 https ,sports
Xavis first goal with FC Barcelona was to qualify for the ChampionsLeague. Update  More on Barcas win over Real Betis   ,sports
 JUST IN  DelhiCapitals players were once again forced into isolation in the ongoing IPL 2022 after a net bowler of the franchise tested positive for COVID19.IPL2022 https ,sports
 DMITRY BIVOL IS UNDEFEATED The Russian beat Canelo Alvarez to retain the WBA World light heavyweight title. AlvarezBivol  WBAhttpst.coXSHfQSeGUw,sports
 Today we celebrate TheIncredibles Wishing all mums out there a very happy MothersDay. Share your incredible moms story with us with the above hashtag. Five of the best entries will receive a free digital subscription to Sportstar.,sports
 MadridOpen Alcaraz makes final Ons Jabeur wins womens title Another NR for Avinash SableShellyAnne Fraser Pryce clocks years fastest 100m IPL2022 MiamiGP PremierLeague newsAll this and more in todays DailyBriefing SportsNews,sports
 HISTORY MADE Ons Jabeur fell to her knees after completing the biggest win of her career becoming the first African player to win a WTA 1000 title.MadridOpen https ,sports
Liverpool drew with Tottenham 11 and went to the top of the PremierLeague but handed ManCity a chance to pull three points clear.LIVTOT  ,sports
FullTime Liverpool goes top of the PremierLeague table temporarily with a draw against TottenhamLiverpool 11 Tottenham  LIVTOT Highlights   ,sports
74 GOAL Luis Diaz shoots from distance and scores after a deflection. Liverpool goes level against Tottenham PremierLeague  LIVTOT Live   ,sports
56 GOAL Son HuengMin gives Tottenham  the lead against Liverpool20 PremierLeague goals for the Korean forwardLIVTOT Live   ,sports
Second Half begins at Anfield as Liverpool and Tottenham look for an opening goal in this PremierLeague fixture.LIVTOT Live  ,sports
HalfTime LFC  00 SpursOfficial Van Dijks header hits the barHojbjergs shot of the woodwork as wellLIVTOT still goalless at the halfway mark in the PremierLeague Live   ,sports
Kickoff The PremierLeague match between Liverpool and TottenhamHotspur is underway at Anfield.LIVTOT Live   ,sports
LIVTOT Lineups outLiverpool Alisson GKAlexanderArnoldKonateVan DijkRobertsonThiagoHenderson ThiagoDiazSalahManeTottenham  Lloris CRoyalRomeroDierDaviesSessegnonBentacurHojbjergKulusevskiSonKanePremierLeague Live   ,sports
LSG beats KKR by 75 runs to move atop the IPL2022 standings.  READ  ,sports
India won its second gold medal in shooting at the ongoing Deaflympics with Abhinav Deshwal claiming the mens 10m air pistol title. https ,sports
As Andre Russell succumbs KKR finds itself on the brink of yet another defeat.  FOLLOW IPL2022 LSGvKKR LIVE  ,sports
Having outlasted a crowd of superstars Karim Benzema has grinded his way to become a leader striker and above all a Galactico at Real Madrid   Neeladri Bhattacharjee https ,sports
KKR finds itself in familiar waters as it loses three wickets in the PowerPlay.  FOLLOW IPL2022 LSGvKKR LIVE  ,sports
66666  Not the best of nights for Shivam Mavi...  FOLLOW IPL2022 LSGvKKR LIVE  ,sports
Jamaican sprint legend ShellyAnn FraserPryce posted the fastest 100m in the world this year as she clocked 10.67secs to win her season opener in Nairobi https ,sports
Santiago Nievas fiveyear stint with the Indian national team included highestever participation at the Tokyo Olympics and historic two medals in the 2019 Mens World Championships. https ,sports
 for KL Rahul. KKR is off to a great start   FOLLOW IPL2022 LSGvKKR LIVE http ,sports
Rajasthan Royals snaps its twomatch losing streak in IPL2022.  ,sports
TOSS Kolkata Knight Riders opt to bowl.  LSG QdK KL Hooda Stoinis Krunal Badoni Holder Chameera Bishnoi Avesh Mohsin  KKR Finch Indrajith Shreyas Rana Rinku Anukul Russell Narine Southee Mavi Rana  FOLLOW IPL2022 LSGvKKR LIVE  ,sports
Is the criticism of Sanju Samsons shot selection warranted Samsons numbers are better than earlier but the consistency narrative is never far away.  Lalith Kalidas on Sanju Samson and the burden of perception. https  IPL2022  PBKSvsRR,sports
When recordbreaker Avinash Sable returns to his hotel room he will force himself to forget the exhilaration hes just felt.  Never look back. Never be satisfied with anything you have done.  Sable will recall these words to press on  Jonathan Selvaraj https ,sports
Indian shuttlers are set to compete at the Thomas and Uber Cup Finals starting tomorrow in Bangkok Thailand.Heres all you need to know about the squad members groups schedule and timings in IST.ThomasUberCups Bangkok2022https ,sports
Tottenham Hotspur manager Antonio Conte believes that only time and money can help the team become contenders and has urged the board to invest in top players if it is to compete with the monsters at the top of the Premier League. EPL football https ,sports
Philadelphias star center Joel Embiid returned from injury to help the reenergized 76ers beat the Miami Heat 9979 on Friday clawing back a game in their NBA playoff series. NBAPlayoffs basketball https ,sports
Rafael Nadal said there were positives to take from the MadridOpen despite the 21time major winner falling to a quarterfinal defeat by teenager Carlos Alcaraz on Friday. Nadal Alcaraz Tennis https ,sports
AsianGames2022 postponedIPL2022  Mumbai Indians stuns Gujarat Titans in lastover thrillerMadridOpen  Alcaraz stuns Nadal to set up semifinal clash with DjokovicAll this and much more in our dailybriefing ,sports
Indias Avinash Sable broke a 30yearold record of Bahadur Prasad in 5000m setting a new national record with a timing of 1325.65 at the Sound Running Track meet in San Juan Capistrano. nationalrecord Athletics https ,sports
Juventuss slim chances of winning the Serie A title ended on Friday after Domenico Criscitos stoppagetime penalty for relegationthreatened Genoa condemned Massimiliano Allegris side to a shock 21 defeat. Juventus football https ,sports
Two goals from Argentine striker Lautaro Martinez helped Inter Milan secure a nervy 42 home win over Empoli on Friday. SerieA InterEmpoli football https ,sports
Chelsea Football Club has confirmed that terms have been agreed with a consortium led by Los Angeles Dodgers partowner Todd Boehly and backed by Clearlake Capital over the acquisition of the  English Premier League football team. Chelsea football https ,sports
Arjun Erigaisi suffered a rare loss but stayed in the joint lead with Hans Moke Niemann at two points after three rounds of the Tepe Sigeman roundrobin chess tournament.  ,sports
Real Madrid begins its countdown to the UCL final against Liverpool by facing Atletico Madrid in a capital derby in LaLiga.  ,sports
G. Sathiyan will train with Swedens Simon Alexander Berglund from May 6 to 27 at the Raman High Performance TT Centre to prepare for Birmingham2022.  ,sports
US Open champion Daniil Medvedev will return from hernia surgery to play at the GenevaOpen after getting a wild card from tournament organizers on Friday.  ,sports
ISL champion Hyderabad FC has announced Appu Jose will be the sides new Sporting Director.  ,sports
ManUtd captain Harry Maguire could return to the side in todays PremierLeague clash against Brighton  Hove Albion.  ,sports
New Zealands Ajaz Patel is auctioning the shirt he wore to claim all 10 wickets in a Mumbai Test in December to raise money for a hospital in Auckland.  ,sports
ICYMI Arsenal manager Mikel Arteta has signed a new contract that will keep him at the London club until 2025.  PremierLeague  ,sports
Points Table watch after Mumbais incredible heist over Gujarat.GTvMI  IPL2022,sports
How about that for a Friday night finish GTvMI  IPL2022   ,sports
Daniel Sams clinches a humdinger for Mumbai Indians MI edges GT by five runs.GTvMI  IPL2022   ,sports
A brilliant throw from Kishan has Hardik short of his creaseGT needs 22 runs in 14 balls to win.GTvMI  IPL2022   ,sports
Murugan Ashwin packs both openers in one over.GT 1112 in 13 overs Target 178GTvMI  IPL2022   ,sports
Carlos Alcaraz has stunned fivetime champion Rafael Nadal in three sets to set up an exciting semifinal clash with world number one Novak Djokovic at MadridMasters.  ,sports
Fifties for both openers as Gujarat deflates the MI attack.GT 1020 in 11.2 oversGTvMI  IPL2022   ,sports
Umran Malik and Jasprit Bumrah should pair up at the T20WorldCup in Australia says Harbhajan Singh.  ,sports
Gill and Saha set up the chase with a solid PowerPlay.GT 540 in 6 overs Target 178GTvMI  IPL2022   ,sports
Mumbai has a Tim David finish GT needs 178 to win in 20 oversGTvMI  IPL2022   ,sports
India won its third shooting medal at the ongoing 24th Deaflympics with Vedika Sharma clinching a bronze in the womens 10m air Pistol event.   ,sports
The postponement of the AsianGames has come as a ray of hope for London Olympics bronze medallist Saina Nehwal.  ,sports
Ishan Kishan holes out on 45.MI 1113 in 12 overs  GTvMI  IPL2022   ,sports
How is the AsianGames postponement going to affect Indian athletes in different sports  ,sports
Rohit falls short of his halfcentury as Rashid strikes for GT.MI 741 in 7.3 oversGTvMI  IPL2022   ,sports
Mumbai Indians posts its best PowerPlay score this season.M 630 in 6 overs Rohit 42 Kishan 19GTvMI  IPL2022   ,sports
Two Diamond League track meets scheduled to be held in China have been cancelled.  ,sports
SportstarAces BYJUS Young Athlete of the Year Esha Singh says she is training for about seven hours a day ahead of the ISSF Junior World Cup in Suhl.   Santadeep Dey   ,sports
TOSS  Gujarat wins toss opts to bowl against Mumbai.GT are unchanged M Ashwin replaces Hrithik Shokeen in MI playing XIGTvMI  IPL2022  https ,sports
ASRoma is offering the 166 fans who were present at the 61 humiliating defeat by Norwegian side BodoGlimt in the group stage free tickets for the EuropaConferenceLeague final.  ,sports
The AsianGames postponement has come as a big disappointment for seasoned archers Tarundeep Rai and Jayanta Talukdar.  ,sports
 If Carlos Alcaraz turns out to be a blend between Federers flair and Nadals never give up spirit no one would really mind.All you need to know about the imperious Spaniard before he takes on Rafael Nadal in Madrid tonight MadridOpen httpsyoutu.bewOAixj11IR4,sports
Kylian Mbappes mother has denied a report that her son has agreed in principle to stay at PSG for up to another three years and shun a move to Real Madrid.  ,sports
Indias topranked International paddler G. Sathiyan will train with Swedens Simon Alexander Berglund from May 6 to 27 at the Raman High Performance TT Centre to prepare for the 2022 Birmingham Commonwealth Games in July. TableTennis https ,sports
Arsenal manager Mikel Arteta has signed a new contract that will keep him at the club until 2025 the Premier League side said on Friday. arsenal football https ,sports
New Zealands Ajaz Patel is auctioning the shirt he wore to claim all 10 wickets in a Mumbai Test in December to raise money for a hospital in Auckland the 33yearold leftarm spinner said. Cricket https ,sports
Saurav Ghosal of India defeated Egypts Youssef Ibrahim 118 711 911 116 119 in 72 minutes on Thursday to reach the J .P. Morgan Tournament of Champions squash championships semifinals . squash https ,sports
The Athletics Federation of India AFI was utterly disappointed with the news of Olympic discus thrower Kamalpreet Kaur testing positive for a banned substance. AFI Athletics  Vijay Lokapally https ,sports
BREAKING The Asian Games due to take place in Hangzhou in September have been postponed until an unspecified date Chinese state media reported on Friday citing the Olympic Council of Asia. asiangames asiangames2022https ,sports
The Chilean Football Federation on Thursday asked FIFA to rule on the eligibility of an Ecuador player alleging he used a false passport and birth certificate and throwing into question the Andean sides participation in this years World Cup. footballhttps ,sports
IPL2022  Warners 92 guides DC to a 21run win against SRHMadridOpen Nadal moves into quarterfinals Murray from Djokovic clash due to illnessGayatri Gopichand to miss UberCup due to hip strainAll this and much more in our dailybriefing ,sports
Rafael Nadal is downplaying his chances in his much anticipated Madrid Open quarterfinal against Carlos Alcaraz  the youngster touted in Spain as his successor. RafaelNadal carlosalcaraz MadridOpen Tennis https ,sports
AS Roma manager Jose Mourinho was left in tears after guiding his side to the Europa Conference League final on Thursday and said Europes thirdtier competition was like its Champions League. EuropaConferenceLeague RomaLCFC football https ,sports
Rafael Nadal saved four match points to beat Belgian David Goffin 63 57 769 in an absorbing match on Thursday and move into the Madrid Open quarterfinals.RafaelNadal MadridOpen Tennis https ,sports
