OTD 3 years ago F1 and Motorsport lost a legend.DankeNiki,sports
Not very long ago T.K. Jesin was being paid Rs 7000 a month for playing sevens football in Malappuram Kerala footballs capital. Now ATK Mohun Bagan is willing to pay Rs 22 lakh to Kerala United for his services  IndianFootball  SantoshTrophy  ,sports
The Milanese battle for this seasons SerieA title continues this weekend...  ,sports
ICYMI Umran Malik bowled the fastest delivery of IPL2022 when he clocked 157 kph in the 20th over against the Delhi Capitals yesterday.  ,sports
Olympic champion Joe Choong will walk away from modern pentathlon if its governing body pushes ahead with a controversial plan to replace horse riding with obstacle racing.  ,sports
Here is a look at Real Madrid and Liverpool in terms of numbers and statistics as they gear up for a repeat of the 201718 UCLfinal. https ,sports
Priya H. Mohan Asias second fastest quartermiler this year will leave for France on Friday for a 25day training and competition trip.  ,sports
Essex has been fined USD 61835 by an independent Cricket Discipline Commission panel after the English county club pleaded guilty to two charges in relation to a racist comment made at a board meeting in 2017. ,sports
Delhi Capitals clinches the vital two points as it edges out Sunrisers Hyderabad by 21 runs. SRHvsDC  IPL2022   ,sports
Shardul dismisses the menacing Pooran.DC has a win in sight as SRH requires 43 runs in two overs.SRHvsDC  IPL2022  https ,sports
Bajrang Punia and Ravi Dahiya will not get direct entries into the final of their respective categories when the national federation holds selection trials for Birmingham2022 and Hangzhou2022.  ,sports
MI has roped in Tristan Stubbs as replacement for the injured Tymal Mills.  IPL2022  ,sports
Englands Jofra Archer says he feared not playing after undergoing two bouts of surgery on his troublesome elbow.  ,sports
Carlos Alcaraz turns 19 today.  The Spaniard seems to have everything that a champion needs. But is he the next Nadal  Paul Fein has more  https ,sports
CSK head coach Stephen Fleming All three departments have been below par.  IPL2022  CSKvRCB   https ,sports
  Andy Murray has withdrawn from his last16 match against Novak Djokovic at the MadridOpen on Thursday due to illness.   https ,sports
Spanish media heaped praise on Real Madrid after the LaLiga winner pulled off a remarkable comeback win against Manchester City to advance to the Champions League final. UefaChampionsLeague RealMadridManCity Read more,sports
Rising Indian doubles player Gayatri Gopichand has pulled out of the upcoming UberCup2022  Finals after being advised rest to recover from a strain in hip joints. httptiny.cciwaruz,sports
Phoenix Suns beat Dallas Mavericks while Miami Heat overpowered Philadelphia 76ers to gain 20 leads in the NBA  playoffs. httptiny.ccrraruz,sports
RafaelNadal  said his recovery from a rib injury has been like a roller coaster after the 21times major winner returned to action with a win over Miomir Kecmanovic at the MadridOpen httptiny.cc6paruz,sports
Global soccer governing body FIFA confirmed that the intercontinental playoffs for the World Cup will be played at Dohas Ahmad Bin Ali Stadium on June 1314.  FIFAWorldCup WorldCup2022 httptiny.cc4naruz,sports
Manchester City manager Pep Guardiola accepted defeat after an astonishing comeback sent Real Madrid into a UefaChampionsLeague  final with Liverpool. RealManCity httptiny.ccymaruz,sports
Everton manager Frank Lampard has been charged with improper conduct by the FA for the comments he made after his team lost 20 away to Merseyside rivals Liverpool last month.  EPL Lampard httptiny.ccxmaruz,sports
Deaflympics2021 Mens 10m Air Rifle   Dhanush Srikanth Shourya Saini Read more httptiny.ccjnaruz,sports
After another magical night at the Santiago Bernabeu stadium Real Madrid coach Carlo Ancelotti put their incredible run to the Champions League final down to a neversaydie attitude that is part of the clubs fabric. UefaChampionsLeague httptiny.ccvmaruz,sports
Discuss thrower Kamalpreet Kaur provisionally suspended after positive test for banned drug.Kaur faces the prospect of being banned for a maximum period of four years if she is found guilty reports K. P. Mohan ,sports
 RCB beat CSK by 13 runs in IPL2022  Real Madrid thumped Man City 65 on aggregate to reach UefaChampionsLeague Finals Rafael Nadal marked a winning return from injury with a win over Miomir Kecmanovic in MadridOpen All this and much more in our dailybriefing ,sports
 SOLD FOR 9.3M   The jersey that Argentina football legend DiegoMaradona wore when scoring twice against England in the 1986 World Cup including the infamous hand of God goal was auctioned for a record sum on Wednesday.   Details    ,sports
RealMadrid fought back from the brink of elimination to beat ManchesterCity 31 after extra time and 65 on aggregate in an enthralling and dramatic ChampionsLeague semifinal.RealMadridManchesterCity UCL ,sports
RealMadrid fought back from the brink of elimination to beat ManchesterCity 31 after extra time and 65 on aggregate in an enthralling and dramatic ChampionsLeague semifinal.RealMadridManchesterCity ,sports
RealMadrid is into the UCL finalMahrez Rodrygo Benzema FullTime RMA 31 MCIRealMadridManchesterCity ends with ManchesterCity out with a 56 loss on aggregate in the ChampionsLeague Highlights   ,sports
Players to score 10 goals in a single UCL knockout stage in ChampionsLeague eraCristianoRonaldo  201617Karim Benzema  202122 Elite Company. RealMadridManchesterCity RealMadridRealMadridManCity Live  ,sports
13 Time UCL Champion RealMadrid is ahead for the first time on aggregate tonight.WHAT. A. MATCH. THIS. RealMadridManchesterCity RealMadridManCity Live   ,sports
95 GOOOAALLLL Benzema scores from the spot to put RealMadrid in front at home.RMA 31 MCI 65 aggt. RealMadridManCity RealManCity RealMadridManchesterCity UCL Live  ,sports
Regulation Time Over RealMadridManchesterCity remains 55 after 90 minutes with Rodrygo the hero for RealMadrid so far.UCL RealMadridManCity We go into ExtratimeLive   ,sports
90 Rodrygo901 RodrygoRealMadrid back on level terms with two quickfire goals in RealMadridManchesterCity RMA 21 MCI 55 RealManCity UCLLive   ,sports
A birthday appearance for Fernandinho . He turns 37 tonight. UCL Live Updates   ,sports
72 Gundogan replaces De Bruyne73 ManchesterCity goes in front with the German playing a key roleUCLPep Mood rn RealMadridManCity Live   ,sports
73 GOAALLL ManchesterCity goes 10 up against RealMadrid with a 53 lead on aggregate.RealMadridManchesterCity RealManCity Live   ,sports
Second Half begins at Madrid at RealMadridManchesterCity as RealMadrid looks to make a comeback in the UCL semifinal.RealManCity Live   ,sports
HalfTime RealMadridManchesterCity remains locked at 00 in UCL semifinal leg 2 with ManchesterCity having a onegoal lead on aggt. against RealMadrid Real Madrid 00 ManCity 34 aggt.RealManCity Live   ,sports
ModricLaporteDe Bruyne tries to make a run and is fouled by Casemiro and a scuffle between Modric and Laporte that follows results to yellow cards to both.RMAMCI RealManCity UCL Live   ,sports
KickOff The UCL semifinal between RealMadrid and ManchesterCity is underway in Madrid.RMA in  ManCity in RealManCity RMAMCI RealMadridManchesterCity Follow Live   ,sports
Glenn Maxwell emerged the unlikely hero as RCB outwitted CSK in the battle of spin and ended its twoweek losing streak in IPL2022 on Wednesday night.  RCBvCSK  ,sports
Cancelo Walker back in starting XIJesus leading the attackManCity lineup out for UCL semifinal leg 2 against RealMadrid EdersonGKCanceloDiasCLaporteWalkerRodriDe BruyneBernardoFodenMahrezJesusRMAMCI RealManCity Live Updates   ,sports
Discuss thrower Kamalpreet Kaur provisionally suspended after positive test for banned drug.  Kaur faces the prospect of being banned for a maximum period of four years if she is found guilty. https ,sports
Lineup of RealMadrid out for the UCL  semifinal second leg with Valverde starting ahead of RodrygoStarting XI Courtois GKCarvajalMilitaoNacho MendyKroosCasemiroModricValverde BenzemaCVinicius Jr.RMAMCI  RealManCity Live updates   ,sports
Thats the big fish Ravindra Jadeja has been dismissed.  FOLLOW IPL2022 RCBvCSK LIVE  ,sports
Mumbaibased Kenkre FC relegated from ILeague in its debut season.  https ,sports
The Hand of God shirt of Diego Maradona is auctioned for 9.3 million dollars.Read   ,sports
Two wickets in two overs RCB is back in the game.  FOLLOW IPL2022 RCBvCSK LIVE  ,sports
English actor and comedian Stephen Fry is all set to become the next president of the Maryleborne Cricket Club MCC. https ,sports
Maheesh Theekshana gets three wickets in the 19th over  FOLLOW IPL2022 RCBvCSK LIVE  ,sports
 Can Pep Guardiolas ManCity take another step closer to that elusive ChampionsLeague trophy  Who will challenge Liverpool for the UCL trophy in Paris   Neeladri Bhattacharjee with the RMAMCI preview httpsyoutu.be4h31xi6oYc0,sports
Rajat Patidar holes out to Mukesh Choudhary. RCB is four down.  FOLLOW IPL2022 RCBvCSK LIVE  ,sports
Royal Challengers Bangalore escapes the PowerPlay unhurt.  FOLLOW IPL2022 RCBvCSK LIVE  ,sports
JUST IN   Senior Womens T20 trophy Railways beats Maharashtra to win 10th title  https ,sports
RCB Faf VK Patidar Maxwell Shahbaz DK Lomror Hasaranga Harshal Siraj Josh  CSK Gaikwad Conway Moeen Uthappa Rayudu MSD Jadeja Pretorius Simarjeet Mukesh Theekshana  FOLLOW IPL2022 RCBvCSK LIVE  ,sports
Odisha is gearing up to host the FIH Mens Hockey World Cup for the second time.   The Kalinga Stadium in Bhubaneswar is getting a face lift as captured by Biswaranjan Rout https ,sports
BREAKING BCCI has banned journalist BoriaMajumdar for two years for intimidating Wriddhiman Saha.Details   ,sports
Bajrang Punia  has already proved his class by securing an Olympics bronze in Tokyo. The ace wrestler who will turn 30 by Paris 2024 has the capability to claim golden glory in the Olympics and prove the skeptics wrong. Y. B. Sarangihttptiny.cc4m9ruz,sports
Ja Morant erupted for 47 points as the Memphis Grizzlies outmuscled the Golden State Warriors to level their Western Conference NBA playoff series with a bruising 106101 victory on Tuesday.  NBA NBAPlayoffs httptiny.cczj9ruz,sports
The annual ICC rankings   Tests  Australia T20s  India  ODIs  New Zealand To know more  httptiny.ccuj9ruz,sports
Jurgen Klopp said reaching his fourth UefaChampionsLeague  final as a coach felt almost like a new experience as his Liverpool side came back from two goals down against Villarreal to secure a 52 aggregate win. httptiny.ccsh9ruz,sports
Liverpool made life difficult for itself against Villarreal but was confident in getting the job done defender Trent AlexanderArnold said after his side came back from two goals down to reach the Champions League final. UefaChampionsLeague httptiny.ccmh9ruz,sports
World number one Novak Djokovic began his quest for a fourth Madrid Open title with a 63 62 victory over Gael Monfils on Tuesday improving his unbeaten record to 180 against the Frenchman. MadridOpen httptiny.ccpg9ruz,sports
 PBKS beat GT by 8 wickets in IPL2022  Liverpool progressed to the UefaChampionsLeague final with a 32 win over Villarreal  Madrid Open Djokovic beat Monfils to stay at the top of ATP rankings All this and much more in our dailybreifing  ,sports
22yearold Safnad will never forget his goal or the way the crowds responded to it. If he is able to experience anything like this again in his career he will be lucky. Such moments and crowds do not happen to an athlete often.  SantoshTrophyhttps ,sports
Liverpool qualified for the Champions League final with a 32 win over Villarreal on Wednesday that secured a 52 aggregate victory.VILLIV UCL Report  ,sports
Liverpool qualified for the Champions League final with a 32 win over Villarreal on Wednesday that secured a 52 aggregate victory.VILLIV UCL Report https ,sports
FULLTIMELiverpool qualifies for the Champions League final in Paris after beating Villarreal 32 on the night and an aggregate score of 52. VILLIV UCL Highlights https ,sports
86 RED CARD Villarreals Etienne Capoue shown his second yellow card for his challenge on Jones. He leaves the field. VILLIV UCL Live https ,sports
74 GOOOAAALLL  Sadio Mane scores Liverpools third on the night as the Reds lead 32 in the match and 52 on aggregate. VILLIV UCL Live https ,sports
67 GOOOOAAALLL Luis Diaz scores to equalize for Liverpool in the match. Match score 22 and Liverpool leads 42 on aggregate.VILLIV UCL Live https ,sports
62 GOOOAAALLL  Fabinhos shot goes under Rulli at the near post. Liverpool pulls one back to make 12 in the match and leads 32 on aggregate. VILLIV UCL Live https ,sports
SECOND HALF KICKOFFVillarreal start the second half of the second leg of the Champions League semifinal against Liverpool with a 20 lead. Aggregate Score Villarreal 22 LiverpoolVILLIV UCL Live https ,sports
HALFTIMEVillarreal with a 20 lead over Liverpool at the break as aggregate scores are level at 22. VILLIV UCL Live https ,sports
41 GOOOAAAALLL Francis Coquelin scores with a brilliant header to double Villarreals lead. VIL 20 LIVAggregate VIL 22 LIVVILLIV UCL Live  https ,sports
3 GOOOAAALLL  Boulaye Dia scores to give an early lead to Villarreal. Villarreal 10 Liverpool Aggregate score Villarreal 12 LiverpoolVILLIV UCL Live https ,sports
KICKOFF  The UCL semifinal second leg between Villarreal and Liverpool is underway at the Estadio de la Cerámica. VILLIV MatchdayLive Live https ,sports
Starting Lineups outVIL  RulliGK Albiol Torres Parejo Capoue Moreno Foyth Estupinan Dia Lo Celso Coquelin.LIV AlissonGK AlexanderArnold Konate Van Dijk Robertson Fabinho Keita Thiago Jota Salah Mane.VILLIV UCL Live https ,sports
Indias budding star Rushil Khosla talks about his teams memorable win in the recent AsiaOceania Qualifiers of the Junior Davis Cup his goals and more.   https ,sports
A few media personnel were told by the police near the entrance to remove their black face masks or black clothing items despite the attendees undergoing a tedious accreditation  Ashwin Achal reports  KheloIndiaUniversityGames  KIUG2021https ,sports
After recording just 1 shot  in the first leg defeat does Villarreal have what it takes to overcome a 20 deficit against the mighty Liverpool later tonight  Neeladri Bhattacharjee previews the UCL semifinal 2nd leg clash. VILLIV,sports
Gyaneshwari Devi and V. Rithika claimed the silver and bronze medals in the womens 49kg weight category. https ,sports
One of crickets oldest career records has been rewritten after Wisden Cricketers Almanack decided to reduce the number of firstclass hundreds scored by Englands W.G. Grace. https ,sports
After overcoming a swollen liver last year Harshada Garud never thought that within a few months she would become the first Indian to win a gold medal in the World junior weightlifting championships.  YB Sarangi on the 18yearolds inspirational story https ,sports
BREAKING Wicketkeeperbatter Nicholas Pooran has been appointed as the whiteball captain of the West Indies mens cricket team following Kieron Pollards international retirement.  https ,sports
The Womens T20 Challenge will be held in Pune from May 23 to 28. https ,sports
After Real yes I probably stop.  Carlo Ancelotti says he will probably retire when he leaves Real Madrid.  https ,sports
Ashleigh Bartys retirement in March when she was womens tennis No. 1 and just 25 years old is a weird one to explain South African cricket legend AB de Villiers says before they team up for a golf event.  https ,sports
Manika Batra attained a careerhigh singles ranking of 38  while G Sathiyan was the best placed Indian male at 34 in the latest International Table Tennis Federation ITTF rankings. Read more,sports
Brentford manager Thomas Frank said he thinks they have a good chance of keeping talismanic playmaker Christian Eriksen beyond this season. EPL Read more,sports
Liverpool is thriving on the pressure of playing for an unprecedented quadruple and every game feels like a final now defender Trent AlexanderArnold said ahead of Tuesdays UefaChampionsLeague  semifinal second leg at Villarreal. Read more,sports
Rajasthan United came from behind to net a lastminute goal against Sreenidi Deccan and win 21 in a chaotic ILeague match at the Kalyani Stadium. Read more,sports
Fulham was in seventh heaven as it sealed the secondtier Championship title with a 70 win over Luton Town on Monday. Read more,sports
Manchester United interim manager Ralf Rangnick said he has yet to speak to Erik Ten Hag about plans for next season but believes the performance in the 30 EPL  win over Brentford was a sign of their future potential.Read more,sports
Defender Raphael Varane scored his first Premier League goal as Manchester United returned to winning ways with a comfortable 30 victory over Brentford.  EPL ManUnited Read more,sports
 KKR beat RR by 7 wickets in IPL2022  Ronnie OSullivan wins record 7th World Snooker title  Kerala beat Bengal to clinch SantoshTrophy2022 title All this and much more in our dailybriefing ,sports
Take a bow Ronnie OSullivan At 46 the Englishman is the oldest World Snooker Champion and has equaled Stephen Hendrys record of seven titles. WorldSnookerChampionship https ,sports
Having chosen not to participate vishy64theking will mentor the team for the ChessOlympiad.  R.B. Ramesh urges fans to respect Anands decision.  https ,sports
SantoshTrophy2022 final ends with Kerala winning the 7th SantoshTrophy with a 54 victory on penalties against WestBengal IndianFootball  KERWB Highlights   ,sports
120 Minutes could not separate Kerala and WestBengal as the SantoshTrophy2022 final heads into a penalty shootoutKER 11 WB  KERWB IndianFootball SantoshTrophy Live   ,sports
UEFA has banned Russian football clubs from participation in 202223 seasons in Champions League Europa League and Europa Conference League. https ,sports
116 GOOOAAALL Bibin equalises for Kerala in extratime against WestBengal in he SantoshTrophy2022 Final.KER 11 WB  KERWB SantoshTrophy IndianFootball Live  ,sports
GOAAAALL Dilip scores through a header to put WestBengal in front against Kerala in the SantoshTrophy2022 final in extratimeKER 01 WBSantoshTrophy KERWB IndianFootball Live  ,sports
Defending champion Railways notched up a comfortable 35run win over Odisha in the second semifinal to set up a summit clash with Maharashtra in the SeniorT20Trophy. https ,sports
15 Shots from Kerala14 Shots from WestBengal Regulation time over but neither team could score a goal in the SantoshTrophy2022 final.ExtraTime beginsLive   ,sports
 Dealing with the Dubai heat  New friends new teammates  Same hunger to win  Captains of the six participating teams in the FairBreak Invitational 2022 weigh in on the upcoming womens T20 tournament   VIDEO FairBreak Globalhttps ,sports
Second half of the SantoshTrophy2022 final begins as Kerala and WestBengal look for an opening goal.SantoshTrophy IndianFootball KERWB Live   ,sports
HalfTime Kerala and WestBengal remain locked at 00 in spite of 9 shots from both the sides in the SantoshTrophy2022 final.KERWB IndianFootball Live   ,sports
Hero for Kerala in the last match Jesin TK subbed on for Kerala in the SantoshTrophy2022 final against WestBengal KERWB IndianFootball SantoshTrophyLive   ,sports
Priya Mohan outpaced the experienced Dutee Chand to win the 200m gold a day after securing the 400m title at the KheloIndiaUniversityGames  https ,sports
KickOff The SantoshTrophy2022 final is underway in Kerala with the host eyeing the title on home soil against  WestBengal KERWB IndianFootball Live   ,sports
 ALERT   s Harshada Garud wins gold in the World junior weightlifting championships https ,sports
Starting Lineups outKerala  MidhunGKAjaySaheef Sanju GSoyalJijoCRashidShighilArjunNijoVikneshWestBengal  PriyantGKTuhinMonotoshCNabiSubhenduJaySujitMohitoshTanmoyFardinDilipKERWB SantoshTrophyIndianFootballLive   ,sports
All India Chess Federation announces a 20member squad countrys biggest ever for the 44th ChessOlympiad which will be held in Chennai. https ,sports
FIFA punishes Senegal for fan disorder in World Cup playoff game against Egypt shining laser pointers at Salah https ,sports
Evertons Jordan Pickford showed exactly why he is Englands firstchoice goalkeeper after a number of outstanding saves to earn club a 10 EPL  win over Chelsea skipper Seamus Coleman said.football httptiny.ccsf7ruz,sports
Mexico Open  Jon Rahm picked his first win since the 2021 US Open as he shot 2under 69 and totalled 17under. Meanwhile Indias anirbangolf  carded a bogeyfree 5under 67 on the final day to finish T15. Golf httptiny.ccaf7ruz,sports
Goals from Ivan Perisic and Lautaro Martinez earned Inter Milan a nervy 21 win at Udinese as Simone Inzaghis side closed the gap on SerieA  leaders AC Milan to two points.football httptiny.ccyd7ruz,sports
World number one Novak Djokovic said on Sunday that he was heartbroken after his former coach Boris Becker was sent to prison earlier this week in a bankruptcy case in the UK. Tennis BorisBecker httptiny.ccwd7ruz,sports
Yastika Bhatia scored a sublime 71 off 45 balls but that was not enough as Maharashtra outplayed Baroda by six wickets to enter the final of the Senior Womens T20 Trophy.womensT20Trophy CricketTwitter httptiny.cc2h7ruz,sports
Chelsea could still miss out on a top four spot if it continues to have mixed results over its final four games of the EPL  season manager Thomas Tuchel said after the 10 defeat at Everton. football httptiny.ccud7ruz,sports
Naomi Osaka and Garbine Muguruza were among leading players to be knocked out of the MadridOpen  on a day of upsets.Tennis httptiny.ccgd7ruz,sports
The International Olympic Committee IOC has approved Badminton World Federations BWF qualification regulations for Paris 2024 said BWF in a statement. Olympics badminton httptiny.ccif7ruz,sports
Barcelona defeated lowly Mallorca 21 to snap a threematch losing run at Camp Nou in all competitions as it climbed to second in LaLiga  behind champions Real Madrid. football httptiny.ccad7ruz,sports
Arsenal regained fourth spot in the Premier League as it ground out a 21 victory away at West Ham United at the London Stadium on Sunday.  EPL httptiny.cc7d7ruz,sports
Rafael Nadal and Novak Djokovic criticized Wimbledon  s decision to exclude players from Russia and Belarus from taking part in this years tournament following Russias invasion of Ukraine. Tennis httptiny.cc4d7ruz,sports
 LSG and CSK register wins in IPL2022  EPL results  Holger Rune won his maiden ATP title  All this and much more in our dailybriefing ,sports
RajasthanRoyals will look to shrug off the disappointment of a defeat against Mumbai Indians when it meets a struggling KolkataKnightRiders in a return leg IPL2022  Santadeep DeyKKRvRR RR KKR  ,sports
SantoshTrophy 2022 final is set with 32 time Champion Bengal taking on 6 time winner and host Kerala on Monday reports P. K. Ajith Kumarindianfootball ,sports
World number one Novak Djokovic said that he was still struggling mentally to get back to his best after missing the AO2022 and a chunk of the early season due to his refusal to get vaccinated against COVID19 ,sports
Vivianne Miedema scored a pair of piledrivers and Nikita Parris netted her 50th WSL goal from the penalty spot as Arsenal hammered Aston Villa 70. ,sports
ICYMI A double from Leonardo Bonucci earned Juventus a hardfought 21 victory over Venezia in SerieA to allbut secure ChampionsLeague football for next season. ,sports
Emma Raducanu played a near flawless match to dismiss Ukrainian teenager Marta Kostyuk 62 61 in Madrid and reach the last16 of a WTA 1000 tournament for the first time.MadridOpen wtamadrid  ,sports
Son Heungmin struck twice after Harry Kane had opened the scoring as TottenhamHotspur beat Leicester City 31 at home to boost its hopes of ChampionsLeague qualification.TOTLEI PremierLeague ,sports
Sudeva Delhi holds Indian Arrows to a drawKenkre FC downs Real Kashmir to open relegation battleIndianFootball HeroILeague roundup  ,sports
Chennai Super Kings beat Sunrisers Hyderabad by 13 runs for its third win of IPL2022.  ,sports
Holger Rune collected his first ATP title on Sunday when Dutchman Botic van de Zandschulp retired during the first set of the final in Munich.bmwopenbyamex MunichOpen  ,sports
Captain K. L. Rahuls 7th fiftyplus score in his last 10 matches and Mohsin Khans impressive fourwicket haul helped the LucknowSuperGiants LSG do the double over DelhiCapitals DC with a sixrun win in IPL2022  reports Santadeep DeyLSGvDC  ,sports
Rafael Leao took advantage of a late goalkeeping howler as ACMilan went five points clear at the top for the SerieA title race. ,sports
A 182run opening stand between Ruturaj Gaikwad and Devon Conway powers Chennai Super Kings to 2022 against Sunrisers Hyderabad. CSKvSRH IPL2022  ,sports
Richarlison profited from a Chelsea error to secure struggling Everton a 10 Premier League win and what could be a precious three points in its bid to avoid relegation https ,sports
Rafael Nadal said his fitness was far from perfect as he prepares to return to action after a debilitating rib injury for the French Open. https ,sports
17 overs up in the run chase. Capitals need 46 runs from 18 deliveries.IPL2022  LSGvDC ,sports
Italian Francesco Bagnaia won the SpanishGP ahead of Frances reigning world champion Fabio Quartararo. https ,sports
Yuzvendra Chahal and Kuldeep Yadav are currently No. 1 and 2 in the highest wicket takers list in IPL2022 https ,sports
Erriyon Knightons time blitzed those of sprint legends Carl Lewis and Tommy Smith and places him behind only Usain Bolt 19.19sec Yohan Blake 19.26 and Michael Johnson 19.32. https ,sports
